TCP,EEBO,VID,STC,Status,Author,Date,Title,Terms,Pages
A61855,99828674,33105,Wing S6019; ESTC R216963,Free,"Struys, Jan Janszoon, d. 1694.; Morrison, John, 17th cent.; Butler, David, Captain.",1684,"The perillous and most unhappy voyages of John Struys Through Italy, Greece, Lifeland, Muscovia, Tartary, Media, Persia, East-India, Japan, and other places in Europe, Africa and Asia. Containing, I. Most accurate remarks and observations of the distinct qualities, religion, politie, customs, laws and properties of the inhabitants: II. A due description of the several cities, towns, forts, and places of trust, as to their site and strength, fortifications by nature, or art, &c. with other things worthy of note: and, III. An exact memorial of the most disastrous calamities which befell the author in those parts (viz) by ship-wrack, robberies, slavery, hunger, tortures, with other incommodities and hardships. To which are added 2 narrativs sent from Capt. D. Butler, relating to the taking in of Astrachan by the Cosacs. Illustrated with divers curious plates, first designed and taken from the life by the author himself. Rendered out of Nether-dutch by John Morrison·; Reysen door Moscovien, Tartarijen, Oost-Indien. English",Voyages and travels -- Early works to 1800.,398
A61858,12626058,64648,Wing S6021; ESTC R900,Free,"Strype, John, 1643-1737.",1696,David and Saul a sermon preached on the day of national thanksgiving for God's gracious deliverance of the King's Majesty from an assassination and the kingdom from a French invasion / by John Strype ...,"Bible. -- O.T. -- Psalms CXIX, 78 -- Sermons.; Sermons, English.",30
A63153,12656224,65373,Wing T2153; ESTC R17270,Free,"Parkyns, William, Sir, 1649?-1696, defendant.; Friend, John, Sir, d. 1696.; England and Wales. Court of Oyer and Terminer and Gaol Delivery (London and Middlesex).",1696,"The tryal and condemnation of Sir William Parkyns, kt., for the horrid and execrable conspiracy to assassinate His sacred Majesty King William, in order to a French invasion of this kingdom who upon full evidence was found guilty of high treason, at the sessions-house in the Old-Baily, March 24, 1695/6 : together with a true copy of the papers delivered to the sheriffs of London and Middlesex, by Sir J. Freind [sic] and Sir W. Parkins, at the place of execution.","Parkyns, William, -- Sir, 1649?-1696.; Friend, John, -- Sir, d. 1696.; Trials (Treason) -- England.",40
A63178,8258395,41248,Wing T2192; ESTC R24640,Free,"Giles, John.; England and Wales. Court of Quarter Sessions of the Peace (London)",1681,"The tryal of John Giles at the Sessions-House in the Old Bayly, held by adjournment from the 7th day of July, 1680 until the 14th day of the same month the adjournment being appointed on purpose for the said Giles, his trial for a barbarous and inhumane attempt to assasinate and murther John Arnold.",Trials (Murder) -- England.,58
A64070,13337566,99119,Wing T3558; ESTC R14474,Free,"Tyler, Alexander.; H. G. Scanderbeg rediviuus.",1685,"Memoires of the life and actions of the most invincible and triumphant prince, Ihon the Great, third of that name, present king of Poland containing a succinct series of affairs from craddle to his present day : with a particular relation of his many great and stupendious victories obtain'd against the Turks and Tartars, from the time he was first made crown-general, and afterwards elected King of Poland / done in verse, out of H. G's historical account of the said princes life and actions, by a lover of the peace and glory of Christendome.","John -- III Sobieski, -- King of Poland, 1629-1696.",177
A64364,11939791,51259,Wing T704; ESTC R8,Free,"Tenison, Thomas, 1636-1715.",1678,"Of idolatry a discourse, in which is endeavoured a declaration of, its distinction from superstition, its notion, cause, commencement, and progress, its practice charged on Gentiles, Jews, Mahometans, Gnosticks, Manichees Arians, Socinians, Romanists : as also, of the means which God hath vouchsafed towards the cure of it by the Shechinah of His Son / by Tho. Tenison ...",Idols and images -- Worship.; Idolatry.,446
A65351,8254074,41214,Wing W1202; ESTC R24606,Free,"Webb, John, 1611-1672.",1669,An historical essay endeavoring a probability that the language of the empire of China is the primitive language by John Webb.,Chinese language.,223
A65676,13325842,99071,Wing W17; ESTC R14006,Free,"E. W., English gentleman at Naples.",1675,"An exact relation of all the late revolutions in Messina with their original, causes and progress to this present : as it was communicated by a letter / from an English gentleman at Naples to a person of quality here.",Messina (Italy) -- History.,9
A67240,13471961,99703,Wing W382; ESTC R4877,Free,"Walker, Henry, Ironmonger.",1641,"A remarkable revelation of the wandrings of the Church of England i idolatry, superstition and ceremonies from the first motion throught each particular station to the first great period : in parallell with the children of Israel in the desert from Rameses to mount Sinai / by H. Walker ...",Church of England -- Customs and practices.; Church of England -- Controversial literature.; Reformation -- England.,8
A68498,99845697,10615,STC 18487; ESTC S110080,Free,"González de Mendoza, Juan, 1545-1618.; Loyola, Marín Ignacio de, d. 1606. aut; Avanzi, Francesco.",1587,"Nevv Mexico. Otherwise, The voiage of Anthony of Espeio who in the yeare 1583. with his company, discouered a lande of 15. prouinces, replenished with townes and villages, with houses of 4. or 5. stories height, it lieth northward, and some suppose that the same way men may by places inhabited go to the lande tearmed Deʻ Labrador. Translated out of the Spanish copie printed first at Madreel, 1586, and afterward at Paris, in the same yeare.; Historia de las cosas mas notables de la China. English. Selections","Espejo, Antonio de.; Indians of North America -- New Mexico -- Early works to 1800.; New Mexico -- Description and travel -- Early works to 1800.",34
A68538,99848987,14114,STC 18986; ESTC S113757,Free,"Owen, John, 1560?-1622.",1607,"Epigrammatum Ioannis Owen Cambro-Britanni libri tres Ad illustrissinam [sic] D. Mariam Neuille, Comitis Dorcestriæ filiam, patronam suam.; Epigrammata. Selections","Epigrams, Latin -- Early works to 1800.",82
A68617,99847123,12137,STC 20509_pt1; ESTC S111862,Free,"Purchas, Samuel, 1577?-1626.",1625,"Purchas his pilgrimes. part 1 In fiue bookes. The first, contayning the voyages and peregrinations made by ancient kings, patriarkes, apostles, philosophers, and others, to and thorow the remoter parts of the knowne world: enquiries also of languages and religions, especially of the moderne diuersified professions of Christianitie. The second, a description of all the circum-nauigations of the globe. The third, nauigations and voyages of English-men, alongst the coasts of Africa ... The fourth, English voyages beyond the East Indies, to the ilands of Iapan, China, Cauchinchina, the Philippinæ with others ... The fifth, nauigations, voyages, traffiques, discoueries, of the English nation in the easterne parts of the world ... The first part.",Voyages and travels -- Early works to 1800.,995
A69607,12258615,57677,Wing B3862; ESTC R19507,Free,"Crull, J. (Jodocus), d. 1713?; Bouvet, Joachim, 1656-1730.",1699,"The Present condition of the Muscovite empire till the year 1699 in two letters : the first from a gentleman who was conversant with the Muscovite ambassadour in Holland, the second from a person of quality at Vienna, concerning the late Muscovite embassy, his present czarish majesty, the Russian empire and Great-Tartary : with the life of the present emperour of China, by Father J. Bouvet, missionary / by the author of The antient and present state of Muscovy.","Peter -- I, -- Emperor of Russia, 1672-1725.; Kangxi, -- Emperor of China, 1654-1722.; Russia -- History -- Peter I, 1689-1725.",122
A70076,99825001,29362,Wing F2110B; ESTC R15621,Free,"Brandenburg (Electorate). Sovereign (1688-1701 : Frederick III); Friedrich Wilhelm, Elector of Brandenburg, 1620-1688. aut; Holy Roman Empire. Reichstag. aut",1689,"A declaration of His Electoral Highness the Duke of Brandenburgh, concerning the present war with France: directing his subjects and vassals, and all other his dependants, how they are to demean themselves in their trading, negotiation, and all incident occasions during the present war. As also a letter sent from the Imperial Diet at Ratisbon to the thirteen cantons in Switzerland, March 7, 1689. Exhorting them to adhere to His Imperial Majesty, and the princes of the empire, in the present war against France.","Grand Alliance, War of the, 1689-1697 -- Early works to 1800.; Europe -- History -- 1648-1715 -- Early works to 1800.",22
A71305,99847123,12139,STC 20509_pt3; ESTC S111862,Free,"Purchas, Samuel, 1577?-1626.",1625,"Purchas his pilgrimes. part 3 In fiue bookes. The first, contayning the voyages and peregrinations made by ancient kings, patriarkes, apostles, philosophers, and others, to and thorow the remoter parts of the knowne world: enquiries also of languages and religions, especially of the moderne diuersified professions of Christianitie. The second, a description of all the circum-nauigations of the globe. The third, nauigations and voyages of English-men, alongst the coasts of Africa ... The fourth, English voyages beyond the East Indies, to the ilands of Iapan, China, Cauchinchina, the Philippinæ with others ... The fifth, nauigations, voyages, traffiques, discoueries, of the English nation in the easterne parts of the world ... The first part.",Voyages and travels -- Early works to 1800.,1207
A71306,99847123,12140,STC 20509_pt4; ESTC S111862,Free,"Purchas, Samuel, 1577?-1626.",1625,"Purchas his pilgrimes. part 4 In fiue bookes. The first, contayning the voyages and peregrinations made by ancient kings, patriarkes, apostles, philosophers, and others, to and thorow the remoter parts of the knowne world: enquiries also of languages and religions, especially of the moderne diuersified professions of Christianitie. The second, a description of all the circum-nauigations of the globe. The third, nauigations and voyages of English-men, alongst the coasts of Africa ... The fourth, English voyages beyond the East Indies, to the ilands of Iapan, China, Cauchinchina, the Philippinæ with others ... The fifth, nauigations, voyages, traffiques, discoueries, of the English nation in the easterne parts of the world ... The first part.",Voyages and travels -- Early works to 1800.,887
A71307,99847123,12138,STC 20509_pt2; ESTC S111862,Free,"Purchas, Samuel, 1577?-1626.",1625,"Purchas his pilgrimes. part 2 In fiue bookes. The first, contayning the voyages and peregrinations made by ancient kings, patriarkes, apostles, philosophers, and others, to and thorow the remoter parts of the knowne world: enquiries also of languages and religions, especially of the moderne diuersified professions of Christianitie. The second, a description of all the circum-nauigations of the globe. The third, nauigations and voyages of English-men, alongst the coasts of Africa ... The fourth, English voyages beyond the East Indies, to the ilands of Iapan, China, Cauchinchina, the Philippinæ with others ... The fifth, nauigations, voyages, traffiques, discoueries, of the English nation in the easterne parts of the world ... The first part.",Voyages and travels -- Early works to 1800.,1168
A78069,99863328,168597,Wing B6325A; Thomason E985_4; ESTC R203354,Free,"Butler, Samuel, 1612-1680.; Prynne, William, 1600-1669, attributed name.",1659,"Mola asinaria: or, The unreasonable and insupportable burthen now press'd upon the shoulders of this groaning nation: by the headless head, and unruly rulers, that usurp upon the liberties and priviledges of the oppressed people. Held forth in a remonstrance to all those that have yet sound and impartial ears to hear, and duly weighed in the scales of equity and justice ... Wherein is demonstrated, what slavery the nation must subject it self to, by allowing the lawfulness and usurped authority of the pretended Long Parliament now unlawfully and violently held at Westminster. By William Prynne, bencher of Lincolns-Inne.","Prynne, William, 1600-1669 -- Early works to 1800.; Political satire, English -- Early works to 1800.; Great Britain -- Politics and government -- 1649-1660 -- Early works to 1800.",8
A79571,43663199,171936,Wing C39; ESTC R223831,Free,H. C.,1661,"An epitomy of history. Wherein is shewn how severall princes and nations, came to their particular countries and dominions; also many great affaires in Judea, Tartaria, Russsia, Poland, Swethland, Germany Italy, Piedmont, Scotland, England, and many other places throughout the world, from the birth of our Saviour to this present time.",World history -- Early works to 1800.,161
A84199,99896797,136933,Wing E3644B; ESTC R231231,Free,,1664,"The exact effigies of a monstrous Tartar taken in Hungary by the valour of the noble Count Serini February, 1664.","Hungary -- Turkish occupation, 1526-1699 -- Early works to 1800.; Broadsides",1
A88007,99866159,118423,Wing L1599; Thomason E671_20; ESTC R207087,Free,,1652,"A letter sent from his excellency Generall Blake to the King of Denmark touching the Dutch fleet now in the sound; and his desires and proposals unto him, and the rising of the Danes in arms to prevent the landing of any enemy. Also a full relation of the last great sea-fight between the English and the Dutch, and the number sunk and taken. With the taking of an 100 fishermen, and the Hollanders fortifying themselves in Bressies Bay in Scotland. Likewise, the proceedings of Sir George Ascues fleet, his motion westward and his design therein, with the councel of states letter to him with joyfull news from China, and the Christian faith, by many both of the nobility and commonalty there.","Blake, Robert, 1599-1657.; Ayscue, George, -- Sir, fl. 1646-1671.; Anglo-Dutch War, 1652-1654 -- Early works to 1800.; Netherlands -- History -- 1648-1714 -- Early works to 1800.; Great Britain -- History, Naval -- Stuarts, 1603-1714 -- Early works to 1800.",8
A96182,99896863,137127,Wing W1294A; ESTC R231670,Free,"Wells, John, fl. 1675.",1675,"Academy. By the Kings priviledge. The most curious and profitable engine that ever was invented, is that which the Kings Majesty hath given leave to John Wells to establish thorowout all England by vertue of his letters patents sealed with the Great Seal of England, forbidding all other persons to undertake, make, or imitate the same, under the penalty specified in the said letters patents, without the power and leave of the aforesaid John Wells. By the means of the foresaid machine, composed of artificial horses, ...",Inventions -- Early works to 1800.; Broadsides,1
A96560,38875560,152509,Wing W2437; ESTC R42669,Free,"William III, King of England, 1650-1702.",1696,"By the King, a proclamation ... issued for the apprehending several persons therein named who ... had entred into a ... conspiracy to assassinate and murder Our Royal Person ... (viz.) Sir George Barclay [and others] ...","William -- III, -- King of England, 1650-1702 -- Assassination attempt, 1696.; Barclay, George, -- Sir, fl. 1696.; Great Britain -- History -- William and Mary, 1689-1702.; Broadsides -- London (England) -- 17th century.",1
B06625,52529108,179264,Wing W2433; ESTC R186686,Free,"England and Wales. Sovereign (1694-1702 : William III); William, III, King of England, 1650-1702.",1696,"By the King a proclamation. William R. Whereas His Majesty hath received information upon oath, that the persons hereinafter named have with divers other wicked and traiterous persons entred into a horrid and detestable conspiracy, to assassinate and murder his Majesties sacred person ...","William, -- III, -- King of England, 1650-1702 -- Assassination attempt, 1696 -- Early works to 1800.; Great Britain -- History -- William and Mary, 1689-1702 -- Early works to 1800.; Broadsides -- Scotland -- 17th century.",1
K001334.001,,,,Free,"Goldsmith, Oliver, 1730?-1774.",1762,"The citizen of the world: or, letters from a Chinese philosopher, residing in London, to his friends in the east. ...",,277
K001334.002,,,,Free,"Goldsmith, Oliver, 1730?-1774.",1762,"The citizen of the world: or, letters from a Chinese philosopher, residing in London, to his friends in the east. ...",,251
K024533.000,,,,Free,"Merande, D.",1768,"A succinct account of a machine, newly invented for the cure of præternatural curvatures of the spine: together with a detail of several cases, in which this machine has been tried with great success. By D. Merande, M.D",,23
K031107.000,,,,Free,"Garrick, David, 1717-1779.",1784,"Arthur and Emmeline: A dramatic entertainment, in two acts, taken from the masque of King Arthur, by Dryden. And now performed at the Theatre-Royal in Drury-Lane, with variety of scenes and machinery. ...; King Arthur or the British worthy",,38
K043175.000,,,,Free,"Murphy, Arthur, 1727-1805.",1759,"The orphan of China: a tragedy, as it is perform'd at the Theatre-Royal, in Drury-Lane.",,105
K047676.000,,,,Free,"Murphy, Arthur, 1727-1805.",1768,Zenobia: a tragedy: As it is performed at the Theatre Royal in Drury-Lane. By the author of The orphan of China.,,90
K053286.000,,,,Free,,1779,"A short history of drugs: &c. likewise china and lacquered ware the produce of the East-Indies. Published for the sole direction of the commanders and officers in that service. Who are allowed private-trade, homeward bound: ...",,74
K082105.000,,,,Free,"Donovan, E. (Edward), 1768-1837.",1798,"An epitome of the natural history of the insects of China: comprising figures and descriptions ... By E. Donovan, ...",,147
K091879.000,,,,Free,"Brooke, Frances, 1724?-1789.",1783,"Rosina: a comic opera, in two acts. Performed at the Theatre-Royal in Covent-Garden.",,37
K113552.001,,,,Free,"Goldsmith, Oliver, 1730?-1774.",1762,"The citizen of the world: or letters from a Chinese philosopher, residing in London, to his friends in the east. ...",,288
K113552.002,,,,Free,"Goldsmith, Oliver, 1730?-1774.",1762,"The citizen of the world: or letters from a Chinese philosopher, residing in London, to his friends in the east. ...",,263
N00609,,,Evans 743; Wing J1111,Free,"Jamison, David, 1660-1739.",1696,"A journal of what passed in the expedition of His Excellency Col. Benjamin Fletcher, captain general and governour in chief of the province of New-York, &c. to Albany, to renew the covenant chain with the five canton nations of Indians, the Mohaques, Oneydes, Onondages, C[...]es and Sinnekes.","Fletcher, Benjamin, 1640-1703.; Five Nations.; Iroquois Indians -- Government relations.; Albany (N.Y.) -- History.; New York (State) -- History -- King William's War, 1689-1697.; United States -- History -- King William's War, 1689-1697.",12
N02310,,,Evans 2746,Free,"Greenwood, Isaac, 1702-1745.",1726,"An experimental course of mechanical philosophy. Whereby such a competent skill in natural knowledge may be attained to, (by means of various instruments, and machines, with which there are above three hundred curious, and useful experiments performed) that such persons as are desirous thereof, may, in a few weeks time, make themselves better acquainted with the principles of nature, and the wonderful discoveries of the incomparable Sir Isaac Newton, than by a years application to books, and schemes. / By Isaac Greenwood, A.M.","Astronomy -- Outlines, syllabi, etc.; Physics -- Outlines, syllabi, etc.",13
N03126,,,Evans 3776,Free,"Greenwood, Isaac, 1702-1745.",1734,"Explanatory lectures on the orrery, armillary sphere, globes and other machines, instruments, and schemes made use of by astronomers: accompanied with a great variety of physical experiments and curious remarks. / By Isaac Greenwood, A.M. Hollisian Professor of Philosophy & Mathematicks.","Physics -- Outlines, syllabi, etc.; Astronomy -- Outlines, syllabi, etc.",5
N04363,,,Evans 5395,Free,"Franklin, Benjamin, 1706-1790.; Evans, Lewis, 1700?-1756, ill.; Turner, James, d. 1759, engraver.",1744,"An account of the new invented Pennsylvanian fire-places: wherein their construction and manner of operation is particularly explained; their advantages above every other method of warming rooms demonstrated; and all objections that have been raised against the use of them, answered and obviated. : With directions for putting them up, and for using them to the best advantage. : And a copper-plate, in which the several parts of the machine are exactly laid down, from a scale of equal parts.","Stoves, Wood.; Fireplaces.; Advertisements -- Stoves, Wood.",42
N12110,,,Evans 15282,Free,"Dawes, Thomas, 1757-1825.; Langdon, Samuel, 1723-1797, dedicatee.",1777,The law given at Sinai: a poem. / By a young gentleman.,Revelation on Sinai -- Poetry.; Poems -- 1777.,10
N12544,,,Evans 15853,Free,"Hume, David, 1711-1776.; Smith, Adam, 1723-1790.; Strahan, William, 1715-1785.; Poivre, Pierre, 1719-1786. Travels of a philosopher.",1778,"The life of David Hume, Esq; the philosopher and historian, written by himself. ; To which are added, The travels of a philosopher, containing observations on the manners and arts of various nations, in Africa and Asia. From the French of M. Le Poivre, late envoy to the King of Cochin-China, and now intendant of the isles of Bourbon and Mauritius.","Hume, David, 1711-1776.; Agriculture -- Tropics.; Africa -- Description and travel.; Asia -- Description and travel.; Travel literature.; Booksellers' advertisements -- Pennsylvania -- Philadelphia.",62
N13972,,,Evans 17681,Free,"Rathbun, Valentine, b. 1724.",1782,"A brief account of a religious scheme, taught and propagated by a number of Europeans, who lately lived in a place called Nisqueunia, in the state of New-York, but now residing in Harvard, Commonwealth of Massachusetts, commonly called, Shaking Quakers. / By Valentine Rathbun, Minister of the Gospel. ; [Two lines from Proverbs] ; To which is added, A dialogue between George the Third of Great-Britain, and his ministers; giving an account of the late London mob, and the original of the sect called Shakers. ; The whole being a discovery of the wicked machinations of the principal enemies of America.",Shakers.; Harvard (Mass.) -- Church history.; Watervliet (N.Y.) -- Church history.; Dialogues.,36
N15973,,,Evans 20444,Free,"Kolb, Peter, 1675-1726.; Le Comte, Louis, 1655-1728.; Wolf.",1787,"A Collection of voyages and travels, containing I. The voyage of Peter Kolben, A.M. to the Cape of Good Hope. II. A voyage to China, by Lewis Le Compte. III. Anecdotes of the elephant, from W[olf's] Travels.",Travel literature.; Anthologies.,133
N17383,,,Evans 22469,Free,"Dodsley, Robert, 1703-1764.; Chesterfield, Philip Dormer Stanhope, Earl of, 1694-1773.; Hill, John, 1714?-1775.",1790,"The oeconomy of human life, complete, in two parts: / translated from an Indian manuscript, written by an ancient Bramin. ; To which is prefixed, an account of the manner in which the said manuscript was discovered; in a letter from an English gentleman residing in China, to the Earl of *******.","Conduct of life.; Maxims.; Booksellers' advertisements -- New York (N.Y.).; Advertisements -- Medicines, Patent, proprietary, etc.",84
N24679,,,Evans 32696,Free,"Poivre, Pierre, 1719-1786.",1797,"Travels of a philosopher; or, Observations on the manners and arts of various nations in Africa and Asia. By M. Le Poivre, late envoy to the King of Conchin-China.; Voyages d'un philosophe. English",Agriculture -- Africa.; Agriculture -- Asia.; Africa -- Description and travel.; Asia -- Description and travel.; Travel literature.,93
N25272,,,Evans 33487,Free,"Campbell, Donald, 1751-1804.; Tanner, Benjamin, 1775-1848, engraver.; Mathews, Richard.; Campbell, Donald, 1751-1804. Journey over land to India.",1798,"A narrative of the extraordinary adventures, and sufferings by shipwreck & imprisonment, of Donald Campbell, Esq. of Barbreck: with the singular humours of his Tartar guide, Hasan Artaz; : comprising the occurrences of four years and five days, in an overland journey to India. : In a series of letters to his son. : [Three lines from Young]",Voyages and travels.; Prisoners -- India.; Shipwrecks.; Europe -- Description and travel; India -- Description and travel; Captivity narratives.,417
N28147,,,Evans 37521,Free,"Glendy, John, 1755-1832.",1800,"An oration, on the death of Lieut. Gen. George Washington, composed on the special request of the commandant and his brother officers, of the cantonment in this vicinity, and delivered at Staunton, on the twenty second day of February last past, 1800. / By Rev. John Glendy, Minister of the Gospel. ; [Six lines of Scripture texts]","Washington, George, 1732-1799 -- Death and burial.; Sermons -- 1800.",26
N29532,,,Shipton 39334; Wing E1236,Free,"Leverett, John, 1662-1724.",1698,"Association. Whereas there has been a horrid and detestable conspiracy formed and carried on by Papists and other wicked and traiterous persons for assassinating His Majesties royal person ... We whose names are hereunto subscribed, do heartily ... declare, that his present Majesty King William is rightful and lawful King of the realms of England, Scotland and Ireland ...","William -- III, -- King of England, 1650-1702.; Great Britain -- Colonies -- America.; Broadsides.",2
A03777,99854094,19501,STC 13897; ESTC S118887,Restricted,"Hubbard, William.",1569,"The tragicall and lamentable historie of two faythfull mates Ceyx kynge of Thrachine, and Alcione his wife: dravven into English meeter. By W. Hubbard. 1569",,18
A08442,99837257,1572,STC 18764; ESTC S101443,Restricted,"Ochino, Bernardino, 1487-1564.; Bacon, Anne Cooke, Lady, 1528?-1610.",1548,"Sermons of Barnardine Ochine of Sena godlie, frutefull, and uery necessarye for all true Christians translated out of Italien into Englishe","Sermons, Italian -- 16th century.",79
