TCP,EEBO,VID,STC,Status,Author,Date,Title,Terms,Pages
A00400,99837510,1836,STC 10529; ESTC S101702,Free,"Escalante, Bernardino de, 16th cent.; Frampton, John, fl. 1577-1596.",1579,"A discourse of the nauigation which the Portugales doe make to the realmes and prouinces of the east partes of the worlde and of the knowledge that growes by them of the great thinges, which are in the dominions of China. Written by Barnardine of Escalanta, of the realme of Galisia priest. Translated out of Spanish into English, by Iohn Frampton.; Discurso de la navegacion que los portugueses hazen à los reinos y provincias del Oriente. English","Asia -- Description and travel -- Early works to 1800.; Portugal -- History -- Period of discoveries, 1385-1580 -- Early works to 1800.",94
A00709,99837816,2159,STC 10840; ESTC S102015,Free,"Feynes, Henri de.; Loiseau de Tourval, Jean.",1615,"An exact and curious suruey of all the East Indies, euen to Canton, the chiefe cittie of China all duly performed by land, by Monsieur de Monfart, the like whereof was neuer hetherto, brought to an end. VVherein also are described the huge dominions of the great Mogor, to whom that honorable knight, Sir Thomas Roe, was lately sent ambassador from the King. Newly translated out of the trauailers manuscript.",Voyages and travels -- Early works to 1800.; Asia -- Description and travel -- Early works to 1800.,52
A01864,99838987,3380,STC 12003; ESTC S103230,Free,"González de Mendoza, Juan, 1545-1618.; Parke, Robert, fl. 1588.; Loyola, Martín Ignacio de, d. 1606.",1588,"The historie of the great and mightie kingdome of China, and the situation thereof togither with the great riches, huge citties, politike gouernement, and rare inuentions in the same. Translated out of Spanish by R. Parke.; Historia de las cosas mas notables de la China. English",Philippines -- Description and travel -- Early works to 1800.; Latin America -- Description and travel -- Early works to 1800.; China -- Description and travel -- To 1900.,419
A02614,99839568,3999,STC 12744; ESTC S103823,Free,"Hanmer, Meredith, 1543-1604.",1586,"The baptizing of a Turke A sermon preached at the Hospitall of Saint Katherin, adioyning vnto her Maiesties Towre the 2. of October 1586. at the baptizing of one Chinano a Turke, borne at Nigropontus: by Meredith Hanmer, D. of Diuinitie.","Chinano -- Sermons -- Early works to 1800.; Sermons, English -- 16th century.",90
A03250,99854936,20398,STC 13366; ESTC S119729,Free,"Heywood, Thomas, d. 1641.",1609,"Troia Britanica: or, Great Britaines Troy A poem deuided into XVII. seuerall cantons, intermixed with many pleasant poeticall tales. Concluding with an vniuersall chronicle from the Creation, vntill these present times. Written by Tho: Heywood.",,468
A03702,99851433,16705,STC 13828; ESTC S116216,Free,"Hortop, Job.",1591,"The trauailes of an English man Containing his sundrie calalmities indured by the space of twentie and odd yeres in his absence from his natiue countrie; wherein is truly decyphered the sundrie shapes of wilde beasts, birds, fishes, foules, rootes, plants, &c. With the description of a man that appeared in the sea: and also of a huge giant brought from China to the King of Spaine. No lesse pleasant than approued. By I.H. Published with authoritie.; Rare travailes of Job Hortop",Voyages and travels -- E.; West Indies -- Description and travel -- E.; Mexico -- Description and travel -- Early works to 1800.,32
A04899,22145372,25167,STC 1504.5; ESTC S659,Free,"Borri, Cristoforo, 1583-1632.; Ashley, Robert, 1565-1641.",1633,"Cochin-China containing many admirable rarities and singularities of that countrey / extracted out of an Italian relation, lately presented to the Pope, by Christophoro Borri, that liued certaine yeeres there ; and published by Robert Ashley.","Jesuits -- Missions -- Vietnam, Southern.; Missions -- Vietnam, Southern.; Cochin China.",72
A08444,99839906,4367,STC 18766; ESTC S104167,Free,"Ochino, Bernardino, 1487-1564.; Bacon, Anne Cooke, Lady, 1528?-1610.; Argentine, Richard, d. 1568.",1551,"Certayne sermons of the ryghte famous and excellente clerk master Barnardine Ochine, borne within the famous vniuersitie of Siena in Italy, now also an exyle in this lyfe, for the faithful testimony of Iesus Christe. Faythfully translated into Englyshe",Predestination -- Early works to 1800.; Sermons -- 16th century.,208
A08448,99848647,13756,STC 18770; ESTC S113413,Free,"Ochino, Bernardino, 1487-1564.; Ponet, John, 1516?-1556.",1549,"A tragoedie or dialoge of the vniuste vsurped primacie of the Bishop of Rome, and of all the iust abolishyng of the same, made by master Barnardine Ochine an Italian, [and] translated out of Latine into Englishe by Master Iohn Ponet Doctor of Diuinitie, neuer printed before in any language",Papacy -- Controversial literature -- Early works to 1800.,218
A09429,99840299,4786,STC 1972; ESTC S104566,Free,"Best, George, d. 1584.",1578,"A true discourse of the late voyages of discouerie, for the finding of a passage to Cathaya, by the Northvveast, vnder the conduct of Martin Frobisher Generall deuided into three bookes. In the first wherof is shewed, his first voyage ... Also, there are annexed certayne reasons, to proue all partes of the worlde habitable, with a generall mappe adioyned. In the second, is set out his second voyage ... In the thirde, is declared the strange fortunes which hapned in the third voyage ... VVith a particular card therevnto adioyned of Meta Incognita ...","Frobisher, Martin, -- Sir, ca. 1535-1594 -- Early works to 1800.; Arctic regions -- Discovery and exploration -- British -- Early works to 1800.; Northwest Passage -- Early works to 1800.",182
A09829,99840785,5316,STC 20092; ESTC S105055,Free,"Polo, Marco, 1254-1323?; Frampton, John, fl. 1577-1596.",1579,"The most noble and famous trauels of Marcus Paulus, one of the nobilitie of the state of Venice, into the east partes of the world, as Armenia, Persia, Arabia, Tartary, with many other kingdoms and prouinces. No lesse pleasant, than profitable, as appeareth by the table, or contents of this booke. Most necessary for all sortes of persons, and especially tor trauellers. Translated into English; Travels of Marco Polo. English",Voyages and travels -- Early works to 1800.; Mongols -- History -- Early works to 1800.; Asia -- Description and travels -- Early works to 1800.,196
A10550,38160688,29294,STC 20822.5; ESTC S5124,Free,"Records, Charles.",1632,"A mostpleasant [sic] dialogue, or, A merry greeting betweene two louers how Will and Nan did fall at strife, and at the last, made man and wife : to the tune of Lusina / [by] C.R.","Ballads, English -- 17th century.; Broadsides -- London (England) -- 17th century.",1
A12471,99847166,12189,STC 22796; ESTC S111906,Free,"Smith, John, 1580-1631.; Cecil, Thomas, fl. 1630, engraver.",1630,"The true travels, adventures, and observations of Captaine Iohn Smith, in Europe, Asia, Affrica, and America, from anno Domini 1593. to 1629 His accidents and sea-fights in the straights; his service and stratagems of warre in Hungaria, Transilvania, Wallachia, and Moldavia, against the Turks, and Tartars ... After how he was taken prisoner by the Turks, sold for a slave ... and escaped ... Together with a continuation of his generall History of Virginia, Summer-Iles, New England, and their proceedings, since 1624. to this present 1629; as also of the new plantations of the great river of the Amazons, the iles of St. Christopher, Mevis, and Barbados in the West Indies. All written by actuall authours, whose names you shall finde along the history.",Voyages and travels -- Early works to 1800.,79
A14850,99837637,1974,STC 25152; ESTC S101834,Free,"Webbe, Edward, b. 1553 or 4.",1590,"The rare and most vvonderfull things vvhich Edvv. VVebbe an Englishman borne, hath seene and passed in his troublesome trauailes in the cities of Ierusalem, Damasko, Bethlehem and Galely and in the landes of Iewrie, Egypt, Gracia, Russia, and Prester Iohn, vvherein is set forth his extreame slauery sustained many yeeres together in the gallies and warres of the great Turke, against the lands of Persia, Tartaria, Spaine, and Portugale.; Rare and most wonderfull things which Edward Webbe hath seene and passed.",Voyages and travels -- Early works to 1800.; Middle East -- Description and travel -- Early works to 1800.; Soviet Union -- Description and travel -- Early works to 1800.,30
A16711,99857551,23305,STC 3611; ESTC S122400,Free,"Brereton, John, 1572-ca. 1619.; Hayes, Edward, fl. 1602.",1602,"A briefe and true relation of the discouerie of the north part of Virginia being a most pleasant, fruitfull and commodious soile: made this present yeere 1602, by Captaine Bartholomew Gosnold, Captaine Bartholowmew [sic] Gilbert, and diuers other gentlemen their associats, by the permission of the honourable knight, Sir Walter Ralegh, &c. Written by M. Iohn Brereton one of the voyage. Whereunto is annexed a treatise, of M. Edward Hayes, conteining important inducements for the planting in those parts, and finding a passage that way to the South sea, and China.","Gosnold, Bartholomew, d. 1607.; Gilbert, Bartholomew.; Virginia -- Description and travel -- Early works to 1800.; America -- Discovery and exploration -- English -- Early works to 1800.",49
A16998,99854321,19735,STC 3879; ESTC S119114,Free,"Broughton, Hugh, 1549-1612.",1605,"Positions of the vvord Hades that it is the generall place of soules: and holdeth as vvell the godly vvhich are in paradise, as the vvicked that are in Tartarus. With a catalogue of our heresies, from which one word handled by a right Grecian would haue saued vs. To the BB. of England. By Hugh Broughton 1605.",Future life -- Early works to 1800.; Hell -- Early works to 1800.,17
A18616,99852131,17438,STC 5141; ESTC S116916,Free,"Nicholas, Thomas, b. ca. 1532, attributed name.",1577,"The strange and marueilous newes lately come from the great kingdome of Chyna which adioyneth to the East Indya. Translated out of the Castlyn tongue, by T.N.",China -- Description and travel -- Early works to 1800.,14
A19712,99844804,9649,STC 6129; ESTC S109154,Free,"Curione, Celio Augustino, 1538-1567.; Newton, Thomas, 1542?-1607.",1575,"A notable historie of the Saracens Briefly and faithfully descrybing the originall beginning, continuaunce and successe aswell of the Saracens, as also of Turkes, Souldans, Mamalukes, Assassines, Tartarians and Sophians. With a discourse of their affaires and actes from the byrthe of Mahomet their first péeuish prophet and founder for 700 yéeres space. VVhereunto is annexed a compendious chronycle of all their yeerely exploytes, from the sayde Mahomets time tyll this present yeere of grace. 1575. Drawn out of Augustine Curio and sundry other good authours by Thomas Newton.; Sarracenicae historiae libri tres. English",Islamic Empire -- History -- Early works to 1800.; Turkey -- History -- Early works to 1800.,282
A19942,99840934,5478,STC 6372; ESTC S105205,Free,"Davis, John, 1550?-1605.",1595,"The vvorldes hydrographical discription Wherein is proued not onely by aucthoritie of writers, but also by late experience of trauellers and reasons of substantiall probabilitie. that the worlde in all his zones clymats and places, is habitable and inhabited, and the seas likewise vniuersally nauigable ... whereby appeares that from England there is a short and speedie passage into the South Seas, to China, Molucca, Phillipina, and India, by northely nauigation ... Published by I. Dauis of Sandrudg by Dartmouth in the countie of Deuon. Gentleman. Anno 1595. May 27.",Northwest Passage -- Early works to 1800.,50
A20049,99857222,22913,STC 649; ESTC S122069,Free,"Anghiera, Pietro Martire d', 1457-1526.; Eden, Richard, 1521?-1576.; Willes, Richard, fl. 1558-1573.",1577,"The history of trauayle in the VVest and East Indies, and other countreys lying eyther way, towardes the fruitfull and ryche Moluccaes As Moscouia, Persia, Arabia, Syria, Ægypte, Ethiopia, Guinea, China in Cathayo, and Giapan: vvith a discourse of the Northwest passage. Gathered in parte, and done into Englyshe by Richarde Eden. Newly set in order, augmented, and finished by Richarde VVilles.; De orbe novo. Decade 1-3. English",Voyages and travels -- Early works to 1800.; America -- Discovery and exploration -- Early works to 1800.,966
A25209,7869782,40213,Wing A2911; ESTC R23666,Free,"Alsop, Vincent, 1629 or 30-1703.",1696,"A sermon upon the wonderful deliverance by His Majesty from assassination, the nation from invasion by Vin. Alsop.","Sermons, English -- 17th century.",39
A25872,12269696,58191,Wing A3755; ESTC R4588,Free,"Rookwood, Ambrose, 1664-1696, defendant.",1696,"The arraignment, tryal, and condemnation of Ambrose Rookwood, for the horrid and execrable conspiracy to assassinate His Sacred Majesty King William, in order to a French invasion of this kingdom who upon full evidence was found guilty of high treason before His Majesty's justices of Oyer and Terminer, at Westminster on Tuesday the 21st of April 1696, and received sentence the day following, and was executed at Tyburn on the 29th day of the said month : in which tryal is contained all the learned arguments of the King's council and likewise the council for the prisoner, upon the new act of Parliament for regulating tryals in cases of treason.","William -- III, -- King of England, 1650-1702.; Rookwood, Ambrose, 1664-1696 -- Trials, litigation, etc.; Trials (Treason) -- England.",80
A25882,12728894,66404,Wing A3767; ESTC R18124,Free,"Cranburne, Charles, d. 1696.; Lowick, Robert, d. 1696.",1696,"The arraignments, tryals and condemnations of Charles Cranburne and Robert Lowick for the horrid and execrable conspiracy to assassinate His Sacred Majesty King William in order to a French invasion of this kingdom who upon full evidence were found guilty of high-treason before His Majesty's justices of Oyer and Terminer at Westminster, and received sentence the 22d. of April, 1696, and were executed at Tyburn the 29th of the said month : in which tryals are contained all the learned arguments of the King's councel, and likewise the councel for the prisoners, upon the new act of Parliament for regulating tryals in cases of treason.","Cranburne, Charles, d. 1696 -- Trials, litigation, etc.; Lowick, Robert, d. 1696 -- Trials, litigation, etc.; William -- III, -- King of England, 1650-1702.",76
A26058,7869634,40182,Wing A4026; ESTC R23635,Free,"Assheton, William, 1641-1711.",1683,"The cry of royal innocent blood heard and answered being a true and impartial account of Gods extraordinary and signal judgments upon regicides : with an historical relation of the deposing, murthering, and assasinating of several kings of England, Scotland, France, &c. ...",Regicides.,143
A26262,13619302,100819,Wing A4275; ESTC R16481,Free,"Avril, Philippe, 1654-1698.; Hakluyt, Richard, 1552?-1616.; Purchas, Samuel, 1577?-1626.",1693,"Travels into divers parts of Europe and Asia, undertaken by the French King's order to discover a new way by land into China containing many curious remarks in natural philosophy, geography, hydrology and history : together with a description of Great Tartary and of the different people who inhabit there / by Father Avril of the Order of the Jesuits ; done out of French ; to which is added, A supplement extracted from Hakluyt and Purchas giving an account of several journeys over land from Russia, Persia, and the Moguls country to China, together with the roads and distances of the places.; Voyage en divers états d'Europe et d'Asie. English",Middle East -- Description and travel.; Asia -- Description and travel.; Europe -- Description and travel.; Europe -- Description and travel -- Early works to 1800.; China -- Description and travel.,421
A26368,11846474,49849,Wing A52; ESTC R14960,Free,"Abbadie, Jacques, 1654-1727.",1696,"The history of the late conspiracy against the king and the nation with a particular account of the Lancashire Plot, and all the other attempts and machinations of the disaffected party since His Majesty's accession to the throne / extracted out of the original informations of the witnesses and other authentick papers.; Histoire de la dernière conspiration d'Angleterre. English","Lancashire Plot, 1689-1694.; Great Britain -- History -- William and Mary, 1689-1702.",198
A26841,11709657,48275,Wing B1165; ESTC R13758,Free,"Baudier, Michel, 1589?-1645.",1682,The history of the court of the king of China out of French.; Histoire de la cour du roy de la Chine. English,China -- Social life and customs.; China -- Court and courtiers.,119
A27548,17762428,106601,Wing B207B; ESTC R38565,Free,W. B.,1693,"A dreadful account of a most terrible earthquake which lately happened in Italy wherein thirty seven great cities and towns were totally destroy'd, and one hundred and twenty thousand of men, women, and children perished, 8c. : in a letter / from the consul of Messina's secretary.",Earthquakes -- Italy.; Natural disasters -- Italy.; Italy -- History -- 17th century.,1
A27814,13960012,102068,Wing B244; ESTC R34189,Free,,1680,"Babel and Bethel, or, The Pope in his colours the Church of Englands supplication to His Majesty our gracious Sovereign, the true defender of the faith, to protect her from all the machinations of Rome and its bloody emissaries.",Anti-Catholicism -- England.,1
A28906,12258607,57676,Wing B3861; ESTC R19507,Free,"Bouvet, Joachim, 1656-1730.; Crull, J. (Jodocus), d. 1713?",1699,"The history of Cang-Hy, the present emperour of China pesented [sic] to the Most Christian King / by Father J. Bouvet, of the Society of Jesus and missionary into China.; Histoire de l'empereur de la Chine. English","Kangxi, -- Emperor of China, 1654-1722.; China -- History -- Kangxi, 1662-1722.",114
A28909,9498396,43307,Wing B3865; ESTC R26546,Free,"Bovet, Richard, b. ca. 1641.",1696,"A poem humbly presented to His Most Excellent Majesty King William the Third upon his most miraculuous and happy preservation from that barbarous Jacobitish conspiracy to assassinate His Royal Person, February anno 1695 / by R.B.","William -- III, -- King of England, 1650-1702 -- Poetry.; Lancashire Plot, 1689-1694 -- Poetry.",14
A28934,26733606,109768,Wing B3919B; ESTC R43065,Free,"Boyer, P. (Pierre), 1619-ca. 1700.",1691,"The Negotiations of the embassadors sent to the Duke of Savoy by the Protestant Swiss-Cantons, in favour of the distressed Vaudois wherein there are many things very curious, and some letters never before published / translated out of French.",Waldenses -- Early works to 1800.; Savoy (France and Italy) -- History -- Early works to 1800.,171
A29216,10802917,45971,Wing B4246; ESTC R29054,Free,"Brand, Adam, d. 1713.; Ludolf, Heinrich Wilhelm, 1655-1710. Curious observations concerning the products of Russia.",1698,"A journal of the embassy from their Majesties John and Peter Alexievitz, emperors of Muscovy &c. over land into China through the provinces of Ustiugha, Siberia, Dauri, and the great Tartary to Peking the capital city of the Chinese empire by Everard Isbrand, their ambassador in the years 1693, 1694, and 1695 written by Adam Brand, secretary of the embassy ; translated from the original High-Dutch printed in Hamburgh, 1698 ; to which is added Curious observations concerning the products of Russia by H.W. Ludolf.; Beschreibung der Chinesischen Reise. English","Ides, Evert Ysbrants.; Natural history -- Soviet Union -- Pre-Linnean works.; Asia -- Description and travel.; China -- Description and travel.",152
A30495,16263806,105165,Wing B5962; ESTC R37171,Free,"Burnett, Andrew, minister of the Gospel.",1696,"A sermon preach'd at Barbican upon the sixteenth of April, 1696 being a day of thanksgiving unto Almighty God for discovering and disappointing an horrid and barbarous conspiracy of papists and other traiterous persons to assassinate and murder His Most Gracious Majesty's royal person, and for delivering this kingdom from an invasion intended by the French / by Andrew Burnett ...","Bible. -- O.T. -- Micah VII, 15-17 -- Sermons.; Sermons, English -- 17th century.; Great Britain -- History -- William and Mary, 1689-1702 -- Sermons.",25
A32797,11742071,48502,Wing C3800; ESTC R17946,Free,"Chevalier, Pierre, 17th cent.; Brown, Edward, 1644-1708.",1672,"A discourse of the original, countrey, manners, government and religion of the Cossacks with another of the Precopian Tartars : and the history of the wars of the Cossacks against Poland.; Histoire de la guerre des Cosaques contre la Pologne. English","Cossacks -- Early works to 1800.; Tatars -- Early works to 1800.; Poland -- History -- Elective monarchy, 1572-1763.",210
A33328,11953454,51479,Wing C4535; ESTC R3775,Free,"Clarke, Samuel, 1599-1682.",1653,"The life of Tamerlane the Great with his wars against the great Duke of Moso, the King of China, Bajazet the Great Turk, the Sultan of Egypt, the King of Persia, and some others ... : wherein are rare examples of heathenish piety, prudence, magnanimity, mercy, liberality, humility, justice, temperance, and valour.","Timur, 1336-1405.",60
A34083,13277204,98727,Wing C549; ESTC R33340,Free,"Carew, George, Esq.",1682,"Lex talionis, or, The Law of marque or reprizals fully represented in the case of spoyls and depredations upon the ships, goods and factories of Sir William Courten and his partners in the East-Indies, China and Japan : whereupon letters patents for reprizals were granted under the great seal of England to continue effectual in the law against the States General of the United Provinces and their subjects ... : together with three several proposals of the creditors, to the King, and their answer (in a postscript) to the Lord Chancellour's arguments upon the scire facias brought by Sir Robert Sawyer ... concerning the letters patents aforesaid.","Courten, William, -- Sir, 1572-1636.; Courten, William, d. 1655.; East India Company.; Great Britain -- History -- Charles II, 1660-1685.",34
A34265,12062696,53303,Wing C5806; ESTC R23060,Free,"Confucius.; Intorcetta, Prospero, 1626-1696.; Confucius. Lun yu. English. Selections. 1691.",1691,"The morals of Confucius, a Chinese philosopher who flourished above five hundred years before the coming of our Lord and Saviour Jesus Christ : being one of the most choicest pieces of learning remaining of that nation.; Confucius Sinarum philosophus. English. Selections","Philosophy, Chinese.; Ethics -- China.",160
A34451,13501814,99781,Wing C6062; Wing C6061_PARTIAL; ESTC R6283,Free,"Cooper, William, fl. 1668-1688.; Helvetius, Johann Friedrich, d. 1709. Vitulus aureus, quem mundus adorat & orat. English.; Glauber, Johann Rudolf, 1604-1670. Novum lumen chimicum. English.",1673,"The Philosophical epitaph of W.C. Esquire for a memento mori on his tomb-stone, vvith three hieroglyphical scutcheons and their philosophical motto's and explanation : with the philosophical Mercury, nature of seed and life, and growth of metalls, and a discovery of the immortal liquor alchahest : the salt of tartar volatized and other elixirs with their differences. Also, A brief of the golden calf, the worlds idol : discovering the rarest miracle in nature, ... / by Jo. Fr. Helvetius. And, The golden ass well managed and Midas restor'd to reason, or, A new chymical light : demonstrating to the blind world that good gold may be found as well in cold as hot regions, and be profitably extracted out of sand, stones, gravel and flints &c. .../ written by Jo. Rod. Glauber. With Jehior, aurora sapientiae, or, The day dawning or light of wisdom : containing the three principles or original of all things whereby are discovered the great and many mysteries of God, nature and the elements, hitherto hid, now revealed / all published by W.C. Esquire. : with a catalogue of chymical books.",Alchemy -- Early works to 1800.; Chemistry -- Bibliography.; Alchemy -- Bibliography.,261
A35221,12259661,57814,Wing C7318; ESTC R21090,Free,"R. B., 1632?-1725?",1700,"The English acquisitions in Guinea & East-India containing first, the several forts and castles of the Royal African Company, from Sally in South Barbary, to the Cape of Good Hope in Africa ... secondly, the forts and factories of the Honourable East-India Company in Persia, India, Sumatra, China, &c. ... : with an account of the inhabitants of all these countries ... : also the birds, beasts, serpents and monsters and other strange creatures found there ... : likewise, a description of the Isle of St. Helena, where the English usually refresh in their Indian voyages by R.B.",Voyages and travels.; Africa -- Description and travel.; Asia -- Description and travel.,190
A35303,11875376,50199,Wing C741; ESTC R31290,Free,"Cary, Philip.",1690,"A just reply to Mr. John Flavell's arguments by way of answer to a discourse lately published, entitled, A solemn call, &c. wherein it is further plainly proved that the covenant made with Israel on Mount Sinai, as also the covenant of circumcision made with Abraham, whereon so much stress is laid for the support of infants baptism ... : together with a reply to Mr. Joseph Whiston's reflections on the forementioned discourse, in a late small tract of his entituled, The right method for the proving of infants baptism ... / by Philip Cary ...","Flavel, John, 1630?-1691.; Cary, Philip. -- A solemn call unto all that would be owned as Christ's.; Whiston, Joseph, d. 1690. -- Right method for the proving of infant baptism.; Infant baptism.",194
