TCP,EEBO,VID,STC,Status,Author,Date,Title,Terms,Pages
A35968,12952559,95992,Wing D1426; ESTC R747,Free,"Digby, Kenelm, Sir, 1603-1665.; Hartman, G. (George)",1682,"A choice collection of rare secrets and experiments in philosophy as also rare and unheard-of medicines, menstruums and alkahests : with the true secret of volatilizing the fixt salt of tartar / collected and experimented by the honourable and truly learned Sir Kenelm Digby, Kt., Chancellour to Her Majesty the Queen-Mother ; hitherto kept secret since his decease, but now published for the good and benefit of the publick by George Hartman.; Choice collection of rare secrets and experiments in philosophy","Medicine, Magic, mystic, and spagiric.; Alchemy.",294
A36106,12643424,65067,Wing D161; Wing D165; ESTC R9942,Free,"Dampier, William, 1652-1715.",1697,"A new voyage round the world describing particularly the isthmus of America, several coasts and islands in the West Indies, the isles of Cape Verd, the passage by Terra del Fuego, the South Sea coasts of Chili, Peru and Mexico, the isle of Guam one of the Ladrones, Mindanao, and other Philippine and East-India islands near Cambodia, China, Formosa, Luconia, Celebes, &c., New Holland, Sumatra, Nicobar Isles, the Cape of Good Hope, and Santa Hellena : their soil, rivers, harbours, plants, fruits, animals, and inhabitants : their customs, religion, government, trade, &c. / by William Dampier ; illustrated with particular maps and draughts.",Voyages around the world.; Voyages and travels.; Buccaneers.; Winds.; Tides.,1112
A36730,11283434,47286,Wing D242; ESTC R5629,Free,"Montanus, Arnoldus, 1625?-1683.; Dapper, Olfert, 1639-1689.; Ogilby, John, 1600-1676.; Nederlandsche Oost-Indische Compagnie.; United Provinces of the Netherlands.",1671,"Atlas Chinensis being a second part of A relation of remarkable passages in two embassies from the East-India Company of the United Provinces to the vice-roy Singlamong and General Taising Lipovi and to Konchi, Emperor of China and East-Tartary : with a relation of the Netherlanders assisting the Tarter against Coxinga and the Chinese fleet, who till then were masters of the sea : and a more exact geographical description than formerly both of the whole empire of China in general and in particular of every of the fifteen provinces / collected out of their several writings and journals by Arnoldus Montanus ; English'd and adorn'd with above a hundred several sculptures by John Ogilby.","Zheng, Chenggong, 1624-1662.; China -- Description and travel.; China -- History -- 1644-1795.",665
A37283,12256129,57510,Wing D463; ESTC R16920,Free,"Day, Henry, M.A.",1694,"A thanksgiving-sermon preach'd at Sutton in Surrey, April the 16th, 1696 being the national thanksgiving day for His Majesty's most happy preservation from the most detestable assassination, in order to a French invasion / by Henry Day ...","William -- III, -- King of England, 1650-1702.; Bible. -- O.T. -- Psalms CXXII, 6 -- Sermons.; Sermons, English -- 17th century.",30
A37401,11076976,46271,Wing D779; ESTC R29345,Free,"Milton, John, 1608-1674.",1674,"A Declaration, or, Letters patents of the election of this present King of Poland, John the Third, elected on the 22d of May last past, Anno Dom. 1674 containing the reasons of this election, the great vertues and merits of the said serene elect, his eminent services in war, especially in his last great victory against the Turks and Tartars, whereof many particulars are here related, not published before / now faithfully translated from the Latin copy by John Milton.","John -- III Sobieski, -- King of Poland, 1629-1696.; Poland -- History -- John III Sobieski, 1674-1696.; Poland -- Politics and government -- 1572-1763.",15
A37640,10051768,44474,Wing E1236; ESTC R27640,Free,"Leverett, John.; England and Wales. Parliament.",1699,Whereas there has been a horrid and detestable conspiracy formed and carried on by papists and other wicked and traiterous persons for assassinating His Majesties royal person,"William -- III, -- King of England, 1650-1702.; Great Britain -- Kings and rulers -- Succession.",1
A39038,12001881,52236,Wing E3848; ESTC R31477,Free,"Walcot, Thomas, d. 1683.; Hone, William, d. 1683.; Rouse, John, d. 1683.",1683,"The Execution and confession with the behaviour & speeches of Capt. Thomas Walcot, William Hone, and John Rouse who according to the sentence pronounced against them at the Old-Bayly, on the 12th instant, were this 20th of July, drawn, hanged and quartered for traytorously conspiring to assassinate and murther the King in his return from New-Market, and the establish'd government to subvert &c.","Rye House Plot, 1683.; Great Britain -- History -- Charles II, 1660-1685.",4
A39697,99830260,34710,Wing F1205A; ESTC R218689,Free,"Flavel, John, 1630?-1691.",1690,"Vindiciæ legis & fœderis: or, A reply to Mr. Philip Cary's Solemn call Wherein he pretends to answer all the arguments of Mr. Allen, Mr. Baxter, Mr. Sydenham, Mr. Sedgwick, Mr. Roberts, and Dr. Burthogge, for the right of believers infants to baptism, by proving the law at Sinai, and the covenant of circumcision with Abraham, were the very same with Adam's covenant of works, and that because the gospel-covenant is absolute. By John Flavel minister of the gospel in Dartmouth","Cary, Philip. -- Solemn call unto all that would be owned as Christ's faithful witnesses, speedily, and seriously, to attend unto the primitive purity of the Gospel doctrine and worship: or, A discourse concerning baptism -- Early works to 1800.; Infant baptism -- Early works to 1800.",175
A39795,12129490,54691,Wing F1333; Wing L898; ESTC R2002,Free,"Fletcher, Giles, 1549?-1611. Tartars, or, Ten tribes.; Lee, Samuel, 1625-1691.",1677,"Israel redux, or, The restauration of Israel, exhibited in two short treatises the first contains an essay upon some probable grounds, that the present Tartars near the Caspian Sea, are the posterity of the ten tribes of Israel / by Giles Fletcher ; the second, a dissertation concerning their ancient and successive state, with some Scripture evidences of their future conversion, and establishment in their own land / by S.L.",,138
A40097,12181747,55682,Wing F1724; ESTC R887,Free,"Fowler, Edward, 1632-1714.",1696,"A sermon preached before the House of Lords in the Abby-Church at Westminster, upon Thursday the sixteenth of April, 1696 being a day of publick thanksgiving to Almighty God for the most happy discovery and disappointment of a horrid design to assasinate His sacred Majesty, and for our deliverance from a French invasion / by Edward Lord Bishop of Gloucester.","Bible. -- O.T. -- Psalms LXXXVI, 12-13 -- Sermons.; Sermons, English -- 17th century.; Great Britain -- History -- William and Mary, 1689-1702 -- Sources.",42
A40439,12251553,57115,Wing F2155; ESTC R7129,Free,"Freire de Andrade, Jacinto, 1597-1657.; Wyche, Peter, Sir, 1628-1699?",1663,"The life of Dom John de Castro, the fourth vice-roy of India wherein are seen the Portuguese's voyages to the East-Indies, their discoveries and conquests there, the form of government, commerce, and discipline of warr in the east, and the topography of all India and China : containing also a particular relation of the most famous siege of Dio, with a map to illustrate it / by Jacinto Freire de Andrada, written in Portuguese ; and by Sr Peter Wyche, Kt., translated into English.; Vida de Dom João de Castro, quarto viso-rey da India. English","Castro, João de, 1500-1548.; Viceroys -- India -- Goa, Daman and Diu.; Goa, Daman and Diu (India) -- History.",319
A40887,12130993,54711,Wing F428; ESTC R2613,Free,"Faria e Sousa, Manuel de, 1590-1649.; Stevens, John, d. 1726.",1695,"The Portugues Asia, or, The history of the discovery and conquest of India by the Portugues containing all their discoveries from the coast of Africk, to the farthest parts of China and Japan, all their battels by sea and land, sieges and other memorable actions, a description of those countries, and many particulars of the religion, government and customs of the natives, &c. : in three tomes / written in Spanish by Manuel de Faria y Sousa ... ; translated into English by Cap. John Stevens.; Asia Portuguesa. English","Discoveries in geography -- Portuguese.; Portuguese -- India.; Portugal -- History -- Period of discoveries, 1385-1580.; India -- History -- 1500-1765.; East Asia -- History.",1508
A41573,99833980,38459,Wing G1303H; ESTC R223695,Free,"Ben Syrach, Gorion.",1671,"Nevvs from the Jews, or a true relation of a great prophet in the southern parts of Tartaria; pretending himself to be sent to gather together the Jews from all parts: as well the ten tribes that have so long abscronded themselves from the world; as the known tribes of Judah and Benjamin: promising to them the restoration of the land of Canaan, and all that they formerly enjoyed in the time of King Solomon. As it was communicated to Rabbi Josuah ben Eleazar, merchant in Amsterdam, by a letter from Adrianople. Faithfully translated into English, by Josephus Philo-Judæus, gent. With allowance.",Prophets -- Early works to 1800.,13
A41836,18419452,107521,Wing G1605; ESTC R39444,Free,"Graves, Edward.",1679,"A brief narrative and deduction of the several remarkable cases of Sir William Courten, and Sir Paul Pyndar, Knights, and William Courten late of London Esquire, deceased their heirs, executors, administrators and assigns, together with their surviving partners and adventurers with them to the East-Indies, China and Japan, and divers other parts of Asia, Europe, Africa and America : faithfully represented to both houses of Parliament.","Courten, William, d. 1655.; Courten, William, -- Sir, 1572-1636.; Pindar, Paul, -- Sir, 1565 or 6-1650.; Nederlandsche Oost-Indische Compagnie.; Merchant ships -- England.; Great Britain -- History -- Stuarts, 1603-1714.; Great Britain -- Foreign relations -- 1603-1688.",18
A42063,10741029,45593,Wing G1906; ESTC R28684,Free,"Gregory, Francis, 1625?-1707.",1696,A thanksgiving sermon for the deliverance of our King from the late intended assassination of his sacred person and of the Kingdom from the French invasion preached by Francis Gregory.,"Thanksgiving Day addresses.; Sermons, English -- 17th century.",28
A43083,12165353,55296,Wing H1150; ESTC R16918,Free,"Haudicquer de Blancourt, Jean, b. ca. 1650.",1699,"The art of glass shewing how to make all sorts of glass, crystal and enamel : likewise the making of pearls, precious stones, china and looking-glasses : to which is added, the method of painting on glass and enameling : also how to extract the colours from minerals, metals, herbs and flowers ... : illustrated with proper sculptures / written originally in French, by Mr. H. Blancourt, and now first translated into English ; with an appendix, containing exact instructions for making glass-eyes of all colours.; De l'art de la verrerie. English",Glass manufacture -- Early works to 1800.; Enamel and enameling -- Early works to 1800.; Precious stones.,334
A43289,11467386,47802,Wing H1402; ESTC R30770,Free,"Helmont, Jean Baptiste van, 1577-1644.; Charleton, Walter, 1619-1707.; Helmont, Franciscus Mercurius van, 1614-1699.",1650,"A ternary of paradoxes the magnetick cure of wounds, nativity of tartar in wine, image of God in man / written originally by Joh. Bapt. Van Helmont and translated, illustrated and amplified by Walter Charleton.",Wounds and injuries -- Treatment.; Science -- Early works to 1800.; Mind and body.,208
A43326,12087792,53791,Wing H1450; ESTC R6723,Free,"Hennepin, Louis, 17th cent.; La Salle, Robert Cavelier, sieur de, 1643-1687.; Joliet, Louis, 1645-1700.; Marquette, Jacques, 1637-1675.",1698,"A new discovery of a vast country in America extending above four thousand miles between New France and New Mexico, with a description of the great lakes, cataracts, rivers, plants and animals : also the manners, customs, and languages of the several native Indians ... : with a continuation, giving an account of the attempts of the Sieur De la Salle upon the mines of St. Barbe, &c., the taking of Quebec by the English, with the advantages of a shorter cut to China and Japan : both parts illustrated with maps and figures and dedicated to His Majesty, K. William / by L. Hennepin ... ; to which is added several new discoveries in North-America, not publish'd in the French edition.; Nouvelle découverte d'un très grand pays situé dans l'Amérique entre le Nouveau Mexique et la mer Glaciale. English",Indians of North America.; Canada -- Discovery and exploration.; Mississippi River Valley -- Discovery and exploration.; Great Lakes -- Discovery and exploration.; Québec (Province) -- History.; Niagara Falls (N.Y. and Ont.) -- Description and travel.,596
A44313,18201849,107031,Wing H2611; ESTC R38964,Free,"Hooke, Robert, 1635-1703.",1674,"Animadversions on the first part of the Machina coelestis of the honourable, learned, and deservedly famous astronomer Johannes Hevelius, consul of Dantzick together with an explication of some instruments / made by Robert Hooke ...","Hevelius, Johannes, 1611-1687. -- Machina coelestis.; Astronomical instruments -- Early works to 1800.; Geometry -- Early works to 1800.",94
A46842,13341465,99142,Wing J697; ESTC R14902,Free,"Sibelius, Caspar, 1590-1658.; Jessey, Henry, 1603-1663.; Shepard, Thomas, 1605-1649. Clear sunshine.; Wilson, John, 1588-1667. Day-breaking.; Winslow, Edward, 1595-1655. Glorious progress of the Gospel.",1650,"Of the conversion of five thousand and nine hundred East-Indians, in the isle Formosa, neere China to the profession of the true God, in Jesus Christ : by meanes of M. Ro, Junius, a minister lately in Delph in Holland / related by ... M. C. Sibellius ... in a Latine letter ; translated ... by H. Jessei ... ; with a post-script of the Gospels good sucesse also amongst the VVest-Indians, in New England.","Junius, Robert, 1606-1655.; Indians of North America -- Massachusetts -- Missions -- Early works to 1800.; Missions -- Formosa.",49
A47924,13102047,97416,Wing L1312; ESTC R7625,Free,"L'Estrange, Roger, Sir, 1616-1704.",1683,"Theosebia, or, The churches advocate endeavouring the promotion of loyalty to our king, and fidelity to the Episcopal Church, by describing the rebellious principles of the enemies thereof, both in their words and actions to our late soveraign King Charles the First, with the most barbarous conspiracies and horrid machinations against King Charles the Second, and his royal brother James Duke of York, whom God preserve.","Charles -- II, -- King of England, 1630-1685.; Great Britain -- History -- Charles II, 1660-1685.",32
A49911,11849698,49913,Wing L831; ESTC R15898,Free,"Le Comte, Louis, 1655-1728.",1697,"Memoirs and observations typographical, physical, mathematical, mechanical, natural, civil, and ecclesiastical, made in a late journey through the empire of China, and published in several letters particularly upon the Chinese pottery and varnishing, the silk and other manufactures, the pearl fishing, the history of plants and animals, description of their cities and publick works, number of people, their language, manners and commerce, their habits, oeconomy, and government, the philosophy of Confucius, the state of Christianity : with many other curious and useful remarks / by Louis Le Compte ... ; translated from the Paris edition, and illustrated with figures.",China -- Description and travel.,724
A50610,11871318,50126,Wing M1705; ESTC R18200,Free,"Pinto, Fernão Mendes, d. 1583.; Cogan, Henry.",1653,"The voyages and adventures of Fernand Mendez Pinto, a Portugal, during his travels for the space of one and twenty years in the Kingdoms of Ethiopia, China, Tartaria, Cauchinchina, Calaminham, Siam, Pegu, Japan, and a great part of the East-Indiaes with a relation and description of most of the places thereof, their religion, laws, riches, customs, and government in time of peace and war : where he five times suffered shipwrack, was sixteen times sold, and thirteen times made a slave / written originally by himself in the Portugal tongue and dedicated to the Majesty of Philip King of Spain ; done into English by H.C. Gent.; Peregrina cam. English",Voyages and travels.; Asia -- Description and travel.,334
A50886,11824989,49654,Wing M2096; ESTC R12100,Free,"Milton, John, 1608-1674.",1682,"A brief history of Moscovia and of other less-known countries lying eastward of Russia as far as Cathay, gather'd from the writings of several eye-witnesses / by John Milton.",Soviet Union -- Description and travel -- Early works to 1800.; Russia -- History -- To 1533.; Russia -- History -- 1533-1613.,118
A51176,12254622,57312,Wing M247; ESTC R12530,Free,"Magalhães, Gabriel de, 1609-1677.",1688,"A new history of China containing a description of the most considerable particulars of that vast empire / written by Gabriel Magaillans, of the Society of Jesus ... ; done out of French.; Doze excelências da China. English",China -- Description and travel.,341
A51229,12877480,94888,Wing M2554; ESTC R321,Free,"Moore, John, 1646-1714.",1696,"A sermon preach'd before the King at St. James's, April 16, 1696 being a day of publick thanksgiving for the discovery of a horrid design to assassinate His Majesty's person, and for the deliverance of the Nation from a French invasion / by ... John, Lord Bishop of Norwich.","William -- III, -- King of England, 1650-1702.; Church of England -- Sermons.; Sermons, English -- 17th century.",38
A51536,31354769,110254,Wing M2999; ESTC R225061,Free,"Moxon, Joseph, 1627-1691.",1674,"A brief discourse of a passage by the North-pole to Japan, China, &c. pleaded by three experiments, and answers to all objections that can be urged against a passage that way ... with a map of all the discovered lands neerest to the pole / by Jospeh Moxon ...",Discoveries in geography -- Early works to 1800.; Northwest Passage.,8
A51539,99834802,39339,Wing M3000B; ESTC N66307,Free,"Moxon, Joseph, 1627-1691.",1676,"A collection of some attempts made to the North-East, and North-West, for the finding a passage to Japan, China, &c. As also somewhat relating to the satisfaction of all inquirers into Captain John Wood's present search of a passage by the North-Pole, &c. By Joesph Moxon, Hydroprapher to the King's most excellent Majesty.",Geography -- Early works to 1800.; Northwest Passage -- Early works to 1800.,2
A52346,12268734,58152,Wing N1153; ESTC R3880,Free,"Nieuhof, Johannes, 1618-1672.; Goyer, Pieter de.; Keizer, Jacob de.; Kircher, Athanasius, 1602-1680. China monumentis. Selections. English.; Ogilby, John, 1600-1676.; Schall von Bell, Johann Adam, 1592?-1666.; Nederlandsche Oost-Indische Compagnie.",1673,"An embassy from the East-India Company of the United Provinces, to the Grand Tartar Cham, Emperor of China deliver'd by their excellencies, Peter de Goyer and Jacob de Keyzer, at his imperial city of Peking : wherein the cities, towns, villages, ports, rivers, &c. in their passages from Canton to Peking are ingeniously describ'd / by Mr. John Nieuhoff ... ; also an epistle of Father John Adams their antagonist, concerning the whole negotiation ; with an appendix of several remarks taken out of Father Athanasius Kircher ; English'd, and set forth with their several sculptures, by John Ogilby Esq. ...; Gezantschap der Neerlandtsche Oost-Indische Compagnie aan den grooten Tartarischen Cham, den tegenwoordigen keizer van China. English",Nederlandsche Oost-Indische Compagnie.; China -- Description and travel.; Netherlands -- Commerce -- China.; China -- Commerce -- Netherlands.,416
A53322,11467216,47786,Wing O270; ESTC R30756,Free,"Olearius, Adam, 1603-1671.; Mandelslo, Johann Albrecht von, 1616-1644.; Davies, John, 1625-1693.",1669,"The voyages and travells of the ambassadors sent by Frederick, Duke of Holstein, to the Great Duke of Muscovy and the King of Persia begun in the year M.DC.XXXIII. and finish'd in M.DC.XXXIX : containing a compleat history of Muscovy, Tartary, Persia, and other adjacent countries : with several publick transactions reaching near the present times : in VII. books. Whereto are added the Travels of John Albert de Mandelslo (a gentleman belonging to the embassy) from Persia into the East-Indies ... in III. books ... / written originally by Adam Olearius, secretary to the embassy ; faithfully rendered into English, by John Davies.",Voyages and travels.; Asia -- Description and travel.; Iran -- Description and travel.,584
A54677,13543540,100105,Wing P200; ESTC R33642,Free,"Palafox y Mendoza, Juan de, 1600-1659.",1671,"The history of the conquest of China by the Tartars together with an account of several remarkable things concerning the religion, manners, and customes of both nations, but especially the latter / first writ in Spanish by Senõr Palafox ... and now rendred English.; Historia de la conquista de la China por el Tartaro. English. 1671","China -- History -- Tatar Conquest, 1643-1644.; China -- Description and travel.",622
A55567,99832340,36813,Wing P3075; ESTC R30536,Free,"Powell, Thomas.",1679,"A sanctuary for the tempted: being a discourse on Christ's friendly admonition to Peter Wherein the fall and rising of Peter, is at large considered: the craft, potency, and malice of Satan (that arch-enemy of our salvation) discovered: his various wiles. stratagems and machinations invalidated: several choice and excellent Gospel-truths handled, and cleared (from the calumnies and objections of gainsayers.) ... Delivered in sundry sermons, at first; and now, published for the benefit of God's church in general. To which is added, four sermons, preach'd upon sacramental occasions. By Thomas Powel, preacher of the Gospel, and one, whom Satan hath winnowed.","Peter, -- the Apostle, Saint -- Early works to 1800.; Sermons, English -- 17th century.",435
A55980,12088446,53802,Wing P3633; ESTC R7069,Free,Amsterdam (Netherlands). Raad.,1684,"A proclamation by the lords of the council in the city of Amsterdam for the apprehending of divers ruffians who endeavoured to assassinate their Burghemaster Van Beuningen, on the 16th of March, offering a reward of a 1000 duckatoons to any that shall discover one or more desperate villains.","Beuningen, Koenraad van, 1622-1693.; Crime -- Netherlands -- Amstersdam -- Early works to 1800.; Criminals -- Netherlands -- Amstersdam -- Early works to 1800.; Broadsides",1
A57131,12381068,60749,Wing R124; ESTC R7857,Free,"Radcliffe, Alexander, fl. 1669-1696.",1680,Bacchinalia cœlestia a poem in praise of Punch / compos'd by the gods and goddesses in Cabal.,Broadsides -- England -- 17th century.,1
A58447,8206450,41092,Wing R840; ESTC R24492,Free,Gentleman of the town of Elvas.,1686,"A relation of the invasion and conquest of Florida by the Spaniards under the command of Fernando de Soto written in Portuguese by a gentleman of the town of Elvas, now Englished. To which is subjoyned two journeys of the present Emperour of China into Tartary in the years 1682 and 1683 : with some discoveries made by the Spaniards in the island of California, in the year 1683.","Soto, Hernando de, ca. 1500-1542.; Florida -- History -- To 1565.",290
A59154,12619181,64464,Wing S2490; ESTC R22006,Free,"Semedo, Alvaro, 1585-1658.; Martini, Martino, 1614-1661. De bello Tartarico historia. English.; Person of quality.",1655,"The history of that great and renowned monarchy of China wherein all the particular provinces are accurately described, as also the dispositions, manners, learning, lawes, militia, government, and religion of the people : together with the traffick and commodities of that countrey / lately written in Italian by F. Alvarez Semedo ... ; now put into English by a person of quality, and illustrated with several mapps and figures ... ; to which is added the history of the late invasion and conquest of that flourishing kingdom by the Tartars ; with an exact account of the other affairs of China till these present times.; Relação da propagação da fe no reyno da China e outros adjacentes. English",Catholic Church -- China.; China -- History -- 960-1644.,359
A59304,12437741,62052,Wing S2675; ESTC R18258,Free,"Settle, Elkanah, 1648-1724.",1676,"The conquest of China by the Tartars a tragedy, acted at the Duke's Theatre / written by Elkanah Settle ...",,76
A60324,12568013,63393,Wing S3931; ESTC R21677,Free,"Sixtus V, Pope, 1520-1590.; Clemens non Papa, Jacobus, ca. 1510-ca. 1555.",1678,"The Catholick cause, or, The horrid practice of murdering kings, justified, and commended by the Pope in a speech to his cardinals, upon the barbarous assassination of Henry the Third of France, who was stabb'd by Jaques Clement, a Dominican Fryar : the true copy of which speech, both in Latin, and also faithfully rendred into English, you have in the following pages.; De Henrici Tertii morte sermo. English & Latin","Henry -- III, -- King of France, 1551-1589.; Regicides.",47
A61053,99830357,34808,Wing S4882A; ESTC R218797,Free,"Speed, John, 1552?-1629.; Goos, Abraham,; Gryp, Dirck,; Speed, John, 1552?-1629. Theatre of the empire of Great Britaine.",1646,"A prospect of the most famous parts of the vvorld Viz. Asia, 3 Affrica, 5 Europe, 7 America. 9 With these kingdomes therein contained. Grecia, 11 Roman Empire, 13 Germanie, 15 Bohemia, 17 France, 19 Belgia, 21 Spaine, 23 Italie, 25 Hungarie, 27 Denmarke, 29 Poland, 31 Persia, 33 Turkish Empire, 35 Kingdome of China, 37 Tartaria, 39 Sommer Ilands, 41 Civill Warres, in England, Wales, and Ireland. You shall find placed in the beginning of the second booke marked with these [3 asterisks in triangle formation] and (5) together with all the provinces, counties, and shires, contained in that large theator of Great Brittaines empire. / Performed by John Speed.","Geography -- Early works to 1800.; Atlases, English -- Early works to 1800.",219
